{"identity":{"probe_revision":"blizzard.semantic-shape.0.1","report_id":"synthetic.semantic.report.001","status":"semantic_shape_observed_pending_review"},"integrity":{"hash_algorithm":"sha256","report_sha256":"9e71186df8f97917445e3cbb30470378e12518bff82b7c4ec6dcca6e8354b072"},"schema_version":"0.1","shape":{"anchor_count":2,"paths":[{"json_type":"object","max_array_length":0,"max_object_keys":2,"occurrences":2,"path":"syntheticRoot"},{"json_type":"boolean","max_array_length":0,"max_object_keys":0,"occurrences":2,"path":"syntheticRoot.syntheticEnabled"},{"json_type":"array","max_array_length":1,"max_object_keys":0,"occurrences":2,"path":"syntheticRoot.syntheticItems"},{"json_type":"object","max_array_length":0,"max_object_keys":2,"occurrences":1,"path":"syntheticRoot.syntheticItems[]"},{"json_type":"string","max_array_length":0,"max_object_keys":0,"occurrences":1,"path":"syntheticRoot.syntheticItems[].syntheticLabel"},{"json_type":"number","max_array_length":0,"max_object_keys":0,"occurrences":1,"path":"syntheticRoot.syntheticItems[].syntheticValue"}]},"source":{"byte_count":549,"content_sha256":"8d921510c23860c0eb717e381c2e0d52d158ad0cc0df0b7302b5e8fff492ded2","receipt_id":"synthetic.semantic.receipt.001","receipt_sha256":"2dd5ac27d6ba5619fa03210fc484af92b683cc013f4ff94f7ef56aff9786c435"}}
